platform,topic,wordcount,audience,title,platform_target,cta,from_platform,source_file
gmb,14 Best Critical Thinking Activities for Employees,,,,,,,
pinterest,Factors Affecting Business Credit,,,,,,,
medium,Why Interpersonal Skills Matter for Leaders in 2025,,,,,,,
medium,Why Interpersonal Skills Matter for Leaders in 2025,,,"5 Interpersonal Skills Every Leader Must Master",,https://edstellar.com/blog/interpersonal-skills,,
blog,Employee Engagement Strategies That Actually Work,1500,HR Leaders,,,https://edstellar.com/blog/engagement,,
linkedin,How to Build a Learning Culture at Work,1200,HR Directors,,,https://edstellar.com/blog/learning-culture,,
linkedin_post,3 Signs Your Team Needs Leadership Training,,L&Ds and HR Managers,,,,,
twitter,Why Most Employee Training Programs Fail,,L&Ds and HR Professionals,,,,,
youtube,Top Corporate Training Trends in 2025,800,L&D Managers,,,https://edstellar.com/corporate-training,,
newsletter,Why Soft Skills Are the New Hard Skills,,HR Leaders and Decision Makers,,,https://edstellar.com/blog/soft-skills,,
quora,What are the most effective employee training methods,,HR Managers and L&D Professionals,,,https://edstellar.com/blog/training-methods,,
instagram,Benefits of Upskilling Your Workforce,,HR and L&D Professionals,,,,,
content_brief,How to Measure Training ROI,1200,HR Directors,,Medium,,,
faq,Leadership Development Programs,,L&Ds and HR Managers,,,,,
meta,Best Corporate Training Programs for Employees,,,,,,,
case_study,How Structured Onboarding Reduced Turnover,,HR Directors,,,https://edstellar.com/blog/onboarding,,
press_release,Edstellar Launches New Leadership Training Module,,HR Leaders and Decision Makers,,,https://edstellar.com/leadership,,
hashnode,Top Python Libraries for Data Science,1000,,,,,,
devto,Getting Started with REST APIs,800,,,,,,
suggestion,HR Leadership,,,,Medium,,,
calendar,Corporate L&D and Workforce Development,,L&Ds HRs and Decision Makers,,LinkedIn Medium Blog,,,
repurpose,Employee Retention Strategies,,HR Directors,,linkedin_post,https://edstellar.com/blog/retention,blog,
